Link,Title,Location,Salary,Summary
https://kr.indeed.com/viewjob?jk=d13fce11058e6cf1,보안 모니터링 시스템 개발 및 운영 담당자 모집,성남 판교역,,"이터 분석을 위한 SIEM/ETL 플랫폼 개발/운영 지원자격 기본사항 경력 3년 이상 Java, Python 등의 언어로 개발 가능자 기본적인 웹 개발 및 Back-End 개발 가능자 DBMS 혹은 빅데이터(NoSQL..."
https://kr.indeed.com/viewjob?jk=29faa893f345e036,GEDP,경기도 성남,,using C programming language Scripting languages like Lua/ Python/JavaScript may also be used if needed Support connected...
https://kr.indeed.com/viewjob?jk=4d62f108017056a2,백엔드개발 인공지능바이오제약코스닥기업,대한민국,,"선과 신규 서비스의 UI, 기능을 설계 및 개발"" ※ 자격조건 - python 개발 경험(기본) - non-sql DB, sql DB 중 1개 이상... 사용 경험 - 풀스택 개발자 - python, C# 동시 사용"" 기타정보..."
https://kr.indeed.com/viewjob?jk=57937c9652167475,VPS Application Engineer - HAV,경기도 성남,,"Proficient in scripting languages used today (e.g., Perl, Python, various shell scripts/Makefiles, XML, JSON, etc.) Industry..."
https://kr.indeed.com/viewjob?jk=1cff0856686c501c,[GC녹십자지놈]AI팀 팀원,용인 기흥구,,모바일·게임>빅데이터·AI(인공지능)>인공지능(AI)|인터넷·IT·통신·모바일·게임>빅데이터·AI(인공지능)> Python|인터넷·IT·통신·모바일·게임>빅데이터·AI(인공지능)>데이터분석|전자·기계·기술·화학·연구개발>광학...
https://kr.indeed.com/viewjob?jk=ba66c0816b106794,LCP Customer Support Engineer,화성 석우동,,components - Storage solutions - Script language - Perl / Python / PHP / BASH... Understanding Factory automation...
https://kr.indeed.com/viewjob?jk=b2661d357cf26c8f,플랫폼쉴드 시스템 개발,성남 분당구,,"IP, 평판 등의 정보) 지원자격 - 전체 개발 경력 3~5년 - Python, Go 개발경력 우대(팀 내부 주 개발 언어가 Go, Python) - 비동기, 병렬처리 프로그래밍 기술 - OS, DB, H/W, 네트워..."
https://kr.indeed.com/viewjob?jk=7bf179a290a157b2,경험최적화파트 - 머신러닝 엔지니어,성남 분당구,,모델 개발 - 머신러닝을 위한 솔루션 프로토타이핑 - 머신러닝 파이프라인 설계 및 구축 지원자격 - Python에 숙련된 프로그래밍 능력과 머신러닝 라이브러리 활용 경험 - 머신러닝과 강화학습에 관련된 지식 습득 혹은...
https://kr.indeed.com/viewjob?jk=1e974ff27c6eb340,Autonomous Driving 분야 엔지니어,서울 강남구,,"프로그래밍 기술 (C/C++, Python 등) - 이동 로봇/드론 관련... platform 개발 경험 - 뛰어난 프로그래밍 기술 (C/C++, Python) - 3D geometry, math, physics 관련 경험 및..."
https://kr.indeed.com/viewjob?jk=20d40ee61adffeca,챗봇 및 상담 플랫폼 서버 개발자 모집,성남 판교역,,"담시스템 코어 서버 개발 (kotlin/spring) QA 시스템 백엔드 서버 개발 (java/spring, python/flask) 챗봇 및 상담 통계 시스템 개발 (scala/spark) 위의 업무 중 하나에 참여하게..."
https://kr.indeed.com/viewjob?jk=1a75ce748c5f24e9,TOAST CAM 임베디드 개발,성남 판교역,,"또는 석사 학위 또는 그에 준하는 실무 경험자 (신입 지원가능) - 임베디드 환경에서 영상 처리 경험자 - Python, C++ 개발 경험 - 딥러닝 프레임워크, 컴퓨터 비젼 경험자 - Visual Object..."
https://kr.indeed.com/viewjob?jk=c57bb3c7bb27ddd7,데이터분석팀 연구원(계약직) 채용 공고,서울 필동,,"자 4) 남자의 경우 병역필 또는 면제자 5) 한글, MS OFFICE 등 기본 문서작업 가능자 6) Python, R 프로그래밍 언어 사용 가능자 우대 2. 모집인원 : O명 3. 근무조건 및 계약기간 구 분..."
https://kr.indeed.com/viewjob?jk=0f139e8552caa762,매치메이킹 서버 개발,성남 분당구,,"습니다. - AWS ECS - AWS Lambda - Go - Python - Redis 사용자의 몰입도를 높이는 매치메이킹 규칙을 구현합... 원자격 -한 가지 이상의 개발 언어( Python, C++, C#, Go 등..."
https://kr.indeed.com/viewjob?jk=e97e5ff34697d5a9,[KRAFTON] 음성 (TTS/STT) 딥러닝 엔지니어,서울,,험을 보유하신 분 독창적인 기술 제시 및 문제 해결을 위한 프로그래밍 능력을 보유하신 분 (C/C++/ Python/shell 등) 오픈소스 기반 딥 러닝 프레임워크 활용 능력을 보유하신 분 (PyTorch/TensorFlow...
https://kr.indeed.com/viewjob?jk=0c32e6464cad3b0a,[카카오 클라우드]DBaaS(DataBase As A Service) 개발자 모집,성남 판교역,,"및 유지 보수 지원자격 필수 자격 협업을 우선 가치로 유연한 커뮤니케이션이 가능하신 분 golang, python 등으로 API 기반 서비스를 구현해본 경험이 있으신 분 서비스 요구 사항을 기능으로 구현할 수 있는 분..."
https://kr.indeed.com/viewjob?jk=4d9591a0cece1e3d,서비스 플랫폼 웹 개발자 모집,성남 판교역,,"기술 트랜드에 지속적인 관심을 가지며, 배움에 적극적인 분 우대사항 - Front-End 웹 개발 경험 - Python, Django Framework을 이용한 서비스 개발 경험 - Kafka, Redis 를 이용한 서비스..."
https://kr.indeed.com/viewjob?jk=f85db44acfff0764,경력직 채용_리스크관리팀,서울,,"험자 - 경제/재무 관련 지식(금융시장, 투자론, 각종 지표 등) 필요 - 엑셀, Bloomberg, SQL, Python 등 프로그래밍 역량 우대 3. 자격사항: 투자자산운용사, CFA, FRM (우대) 전형 절차 서류전형..."
https://kr.indeed.com/viewjob?jk=b231756686b3838e,(주)아이옵스 소프트웨어 개발자,대전 유성구,,"트스트랩, 웹개발, C++, C#, python, java 등 1개 이상의... 우대사항]- 자바스크립트, 부트스트랩, 웹개발, C++, C#, python, java 등 1개 이상의 개발환경 능숙자- Windows, Linux..."
