Link,Title,Location,Salary,Summary
https://kr.indeed.com/viewjob?jk=78a4f752083fb75f,[전국민 누구나 / 비전공자도 가능] 한국표준협회 블록체인 교육생,서울,,통신·모바일·게임>빅데이터·AI(인공지능)>데이터분석|인터넷·IT·통신·모바일·게임>빅데이터·AI(인공지능)> Python|인터넷·IT·통신·모바일·게임>빅데이터·AI(인공지능)>머신러닝|인터넷·IT·통신·모바일·게임>빅데이터...
https://kr.indeed.com/viewjob?jk=4adac8923476d038,프랭클린템플턴투신운용 Junior Trader (Quant base 필수),대한민국,,"object-oriented programming and intermediate programming proficiency in Python, R or MATLAB, and SQL are essential. Licenses..."
https://kr.indeed.com/viewjob?jk=c39d18040425ef53,PostgreSQL 운영 및 데이터베이스 관리자 모집,성남 판교역,,"청하고 잘 이해하는 분 Database 운영 유경험자 ( PostgreSQL 운영 경험이 있으신 분 우대) python, go, bash 등 개발 경험이 있는 분 우대 클라우드 환경의 DB시스템 구축 및 운영 경험이 있는 분..."
https://kr.indeed.com/viewjob?jk=269f9a96319ef19a,머신러닝 엔지니어 모집,성남 판교역,,"델의 성능 검증 및 지속 개선 대규모 로그 데이터 통계 분석을 통한 피쳐 추출 지원자격 #필수사항 Python, Java, C++ 등 언어 중 하나 이상 활용 가능하신 분 TensorFlow/Keras, PyTorch..."
https://kr.indeed.com/viewjob?jk=f5e49e73244edbad,[한국자산평가] 인턴 IT부문,서울 종로구,,웹프로그래머>백엔드|인터넷·IT·통신·모바일·게임>웹프로그래머> Python|인터넷·IT·통신·모바일·게임>응용프로그래머>JAVA|인터넷·IT·통신... 통신·모바일·게임>응용프로그래머> Python|인터넷·IT·통신·모바일·게임...
https://kr.indeed.com/viewjob?jk=87309d3ff40ead61,딥러닝 AI 개발 연구원,성남 수정구,,시스템프로그래머>임베디드(Embedded)|인터넷·IT·통신·모바일·게임>응용프로그래머>C·C++|인터넷·IT·통신·모바일·게임>응용프로그래머>Linux|인터넷·IT·통신·모바일·게임>빅데이터·AI(인공지능)> Python
https://kr.indeed.com/viewjob?jk=90e64b198f0d1e74,"[전주] 랜선하우스 웹개발, Python",전주 완산구,,"소지자 (유)랜선하우스부동산투어 [신입/경력]랜선하우스에서 웹개발, Python 모집합니다. 모집부문 및 자격요건 담당업무 자격요건 인원 [담당업무... 웹프로그래머>웹개발|인터넷·IT·통신·모바일·게임>웹프로그래머> Python"
https://kr.indeed.com/viewjob?jk=67c469c1980a4437,[대형증권사] IT퀀트 개발자,서울 강남구,,"로세스에 대한 이해학력사항: 대학교(4년)졸업 - 이공계 전공, C#, Python,JavaScript,SQL 사용 가능 우대 0 명 근무조건 고용형태... 통신·모바일·게임>웹프로그래머> Python|인터넷·IT·통신·모바일·게임..."
https://kr.indeed.com/viewjob?jk=05121752364559cb,[보안] 보안 솔루션 엔지니어(정규직),대한민국,,"고도화 및 효율화 - 정보보호시스템 로그 관리 및 분석 [자격사항] - 보안 관련 실무 경력 3년 이상 - Python, Shell 등 언어 사용 능력을 보유한 분 - 상용 솔루션 및 각종 OS 등의 취약점 분석 및 대응..."
https://kr.indeed.com/viewjob?jk=c6cbe4d8dd9afcb1,사내 및 서비스 보안 담당자 (경력),대한민국,,"있는 분 - IDS / IPS 패턴 분석 및 Rule 개발 경력이 있는 분 - 각종 스크립트 언어(Perl, Python, shell script 등)의 활용 능력을 갖춘 분 모집기간 채용시 마감 고용형태 정규직"
https://kr.indeed.com/viewjob?jk=9193b9de45a0ac1c,Embedded Software Engineer - Connected,경기도 성남,,"skills with C, C++ and other script languages (i.e. python etc..) Strong knowledge... IOT devices communication protocols..."
https://kr.indeed.com/viewjob?jk=71c47ac87bb4087e,기술 인턴 인공지능 응용 연구/개발 인턴,서울 관악구,,"6개월) (협의) *모집 절차: 서류 à인터뷰(오프라인) *지원 자격: 프로그래밍 언어 활용 능력: Python, C, C++ 중 1가지 이상 데이터구조, 알고리즘 과목 이수 머신러닝과 딥러닝의 기본 개념 이해 머신러닝..."
https://kr.indeed.com/viewjob?jk=56523d2ce6f8d860,NHN Cloud 인프라 서비스 개발,성남 판교역,,우대사항 - NHN Cloud에서 제공하는 다양한 인프라 서비스 개발 - C/C++ 또는 Java/ Python 개발 경력 5년 이상 - Linux 환경 개발자 - Openstack 개발 경험 - Container...
https://kr.indeed.com/viewjob?jk=5ea9ea023c6ccc03,"S/W 엔지니어, 데이터분석 신입/경력 정규직, 인턴",성남 분당구,,"케이션 제작 및 유지보수 업무- Python, Golang, QT 중 선택... 2. 시스템프로그래머- Python, Golang, QT 중 선택 가능3. 영상데이터 분석 및 모델링- python기반 영상데이터 분석 및 모델링..."
https://kr.indeed.com/viewjob?jk=d17da0baecf05910,데이터 분야 경력,서울,,"해가 뛰어난 자 - R, Python, SAS, SQL 등 활용 역량 우대사항(해당 내용 중 1개 이상) - ML/DL 경험 인력 우대 - 관련 분야 석사 이상 학위 소지자 우대 - R, Python등 데이터분석 모델링 경험..."
https://kr.indeed.com/viewjob?jk=b95d00f1145e5ef3,(광주취업맛집1위)2021년도 국비 기술교육생,광주 광산구,,통신·모바일·게임>빅데이터·AI(인공지능)>데이터분석|인터넷·IT·통신·모바일·게임>빅데이터·AI(인공지능)> Python|인터넷·IT·통신·모바일·게임>빅데이터·AI(인공지능)>머신러닝|인터넷·IT·통신·모바일·게임>빅데이터...
https://kr.indeed.com/viewjob?jk=ac775ea3940aa1e8,[웹젠] TA(Unreal Engine 4)(경력),성남 분당구,,"티스트를 위한 툴 제작 및 각종 기술 문서 작성 (Blueprint, python, maxscript) - 아트 컨텐츠 관련 이슈 해결 및 기술 지원... 문서 작성 (Blueprint, python, maxscript) - 아트..."
https://kr.indeed.com/viewjob?jk=ad072f017c286d42,데이터 엔지니어,서울,,"에서의 데이터 파이프라인 구축 및 운영 경험 GA, Tableau 등 외부 분석/시각화 도구에 대한 지식 Python, Java, Scala 중 하나 이상을 이용한 개발 경험 추가 정보 지원 서류 안내 제출서류 : 이력..."
https://kr.indeed.com/viewjob?jk=4ec305f59ce64060,게임이상탐지 분석/개발,성남 분당구,,"기법 적용에 필요한 프로그래밍 능력 ( Python) - SQL 활용 능력... 대시보드 개발 능력 솔루션 개발자 - 한 가지 이상의 개발 언어( Python, Java, Scala)에 숙련된 프로그래밍 능력 - Linux..."
https://kr.indeed.com/viewjob?jk=e5448ffc7d6ecf02,FPGA 플랫폼 엔지니어 (딥러닝 하드웨어 프로세서 개발),성남 분당구,"연봉 40,000,000원 - 100,000,000원","사용 경험(Chip Scope/SignalTap) - Language: Python/Perl, C/C++ - Vivado 또는 Synplify 또는... SignalTap) - Language: Python/Perl, C/C++..."
https://kr.indeed.com/viewjob?jk=c9fdfda54641cddd,(주)엘솔루 웹 개발자,서울,,Stack 개발 유경험자. Javascript / React / Python / NodeJS 개발 유경험자 Node.js 개발 유경험자 HTML 5... ㆍJavascript / React / Python / 인터넷·IT·통신...
https://kr.indeed.com/viewjob?jk=d8a8869ab092f731,데이터 엔지니어 및 사이언티스트,성남 판교역,,"등 데이터 엔지니어와 사이언티스트의 업무를 경계 없이 수행하게 됩니다. 지원자격 개발 경력 3년 이상 Python, Scala, Java, C++ 중 하나 이상의 언어에 능통 SQL 또는 HiveQL에 능통 대용량 데이..."
https://kr.indeed.com/viewjob?jk=376e7df4cd432744,데이터 컨설팅 및 분석분야 경력직 (정규직),과천 과천시,,데이터분석|인터넷·IT·통신·모바일·게임>빅데이터·AI(인공지능)> Python|인터넷·IT·통신·모바일·게임>빅데이터·AI(인공지능)>R|인터넷... 데이터마이닝|인터넷·IT·통신·모바일·게임>응용프로그래머> Python
https://kr.indeed.com/viewjob?jk=8cc372a6b78679b1,"인공지능(AI), Python(응용프로그램 개발자) 외 신입/경력 정규직",서울 성북구,"연봉 25,000,000원 - 30,000,000원","(주)쿠노소프트 인공지능(AI), Python 외 신입/경력 정규직 채용... 래머>인공지능(AI)|인터넷·IT·통신·모바일·게임>응용프로그래머> Python|인터넷·IT·통신·모바일·게임>응용프로그래머>Visual C++(MFC..."
https://kr.indeed.com/viewjob?jk=d5c2721b4f838e42,에프앤가이드 - 각 부문 (전문연구요원 포함),대한민국,,"이공계열 석사학위 이상 취득(예정)자 - 우대사항 : ㆍ SQL, python, R 개발경험 소유자 디지털금융팀 - 담당업무 : ㆍ마이데이터 및... 문을 이해/구현 가능한 분 ㆍ Python 등의 언어를 이용한 서비스 개발..."
https://kr.indeed.com/viewjob?jk=7e17ea213996938d,[신세계디에프] Data Scientist,서울 중구,,"및 제출서류 전형절차 서류 1차면접 2차면접 최종합격 직무/산업 직무별(직종) 응용프로그래머Java, SQL 인공지능(AI).빅데이터인공지능(AI), 빅데이터, 머신러닝, Python 산업별(업종) 유통.백화점.도소매 면세점"
https://kr.indeed.com/viewjob?jk=20abdd225641e77a,"Software QA Infotainment Test Engineer, Bundang, Gyeonggi, K...",경기도 성남,,"one or more scripting languages... Perl, Ruby, Python, or Bash Passionate about troubleshooting failures to determine..."
https://kr.indeed.com/viewjob?jk=61c3e3d37ef5d337,빅데이터(IT) 엔지니어 경력직 채용공고,대한민국,,"Common Data Model 관련 프로젝트 경험자 우대 라. NoSQL, Oracle, Sybase, R, Python 가능자 우대 마. 서버관리/정보보안, 텍스트마이닝 경험자 우대 - 담당업무 가. 데이터 레이크/데이..."
https://kr.indeed.com/viewjob?jk=45f9a39bdf645e57,기술혁신센터 경력사원,충청남도 천안,,"OHT 등) 천안 컴퓨터/시스템 전기/전자 기계/산공 *전문지식 - Java, C#, C++, Python - Oracle (PL/SQL) - Automod, VisualComponent - 통신프로그래밍..."
https://kr.indeed.com/viewjob?jk=ecd0fe8ed259124a,SK 브로드밴드 Biz Analyst 분야 경력사원,서울특별시,,"빅데이터 등 관련 전공자 경력 - 데이터 분석 지식 및 분석 Tool 사용가능자 (SQL, R, Python 등) *필수사항 - Data기반 분석 Insight 도출 및 현업 Communication 에 대한 경험..."
https://kr.indeed.com/viewjob?jk=1c2dec1a2156f6aa,(데이터개발) API플랫폼 개발자,성남 분당구,,"architecture를 구현하고 이를 효과적으로 관리할 수 있는 기반 개발 지원자격 - Java, Go, Python 중 한 가지 이상의 언어를 이용한 웹 서비스 개발 경험이 있으신 분 - MySQL 등의 RDBMS..."
https://kr.indeed.com/viewjob?jk=e8bbe081133f8cd6,보안분야 경력,서울,,"정보보호 자격증 보유 ② 네트워크 스캐닝 및 서버OS침투 경험 ③ Python Exploit 작성 가능, 해킹대회 수상 ④ 웹, 모바일앱 등 다양한... SCADA 프로토콜 이해 ③ Python Exploit 작성 가능 상세..."
https://kr.indeed.com/viewjob?jk=9ab2041ab3380a21,카카오톡 안티어뷰징을 위한 데이터/백엔드 엔지니어 및 머신러닝 전문가 모집,성남 판교역,,"Engineer, Data Scientist 해당 분야에서 활용되는 언어 및 도구를 능숙하게 다룰 수 있는 분( Python, Scala, PyMC, PySpark, Tensorflow 등) 우대 사항 컨테이너 환경에서의..."
https://kr.indeed.com/viewjob?jk=6b909c8efd96c85a,(주)엘솔루 R&D본부 ASR팀 개발직,서울,,"제공 [필수사항] ㆍ프로그래밍에 재능 및 열정이 있는 자 ㆍJava, Python 중 하나 이상의 언어사용자 ㆍWeb 개발능력 ㆍ리눅스 사용 경험자... 머신러닝(ML)|인터넷·IT·통신·모바일·게임>응용프로그래머> Python"
https://kr.indeed.com/viewjob?jk=cd33747ecaa2f3aa,미래금융팀 경력직원(데이터분석),서울 영등포구+1 지역,,인터넷·IT·통신·모바일·게임>ERP·시스템분석·설계>데이터분석|인터넷·IT·통신·모바일·게임>웹프로그래머> Python|인터넷·IT·통신·모바일·게임>응용프로그래머> Python
https://kr.indeed.com/viewjob?jk=89f3e10d77a126bf,Field Service Engineer,경기도 용인,,"troubleshooting. Preferably to have coding capability (Matlab, Python...etc... data analysis, visualization, and algorithm..."
https://kr.indeed.com/viewjob?jk=dcdd6c20bd460c01,System Engineer 모집,성남 판교역,,"인프라 운영 경험 (프로비저닝, 설정 관리, 모니터링 등) - 운영에 필요한 도구 개발 (Shell / Python 중 하나 이상의 개발 경험 및 REST API 활용) 역량 우대사항 - 글로벌 서비스 Architecture..."
https://kr.indeed.com/viewjob?jk=c71c1fa9e0d43937,악성코드 및 엔드포인트 위협 대응 보안 엔지니어 모집,성남 판교역,,"발견하고 개선하고자 하는 능동적인 성격 우대사항 API 활용 SOAR 구성 node.js 프레임워크 경험자 Python/Linux shell script 중급 이상 가능자 필독사항 ※ 카카오 테크 직군의 경우, 개발..."
https://kr.indeed.com/viewjob?jk=918468d6e12a17e8,네트워크 엔지니어링,성남 판교역,,"관리 도구 개발/운영 - 관련학과 졸업 후, 경력 3년 이상 - 리눅스 환경 개발 경력 2년 이상 - Python, Django, Javascript 관련 개발 경험 - CCNA 또는 JNCIA 이상의 자격증 보유..."
https://kr.indeed.com/viewjob?jk=efa408aa5fb39d12,"데이터 분석 시스템 개발자 (3년차, 정규직)",서울 영등포구,,통신·모바일·게임>빅데이터·AI(인공지능)>빅데이터|인터넷·IT·통신·모바일·게임>빅데이터·AI(인공지능)> Python|인터넷·IT·통신·모바일·게임>빅데이터·AI(인공지능)>머신러닝|인터넷·IT·통신·모바일·게임>데이터베이...
https://kr.indeed.com/viewjob?jk=eaee1538d8cc832f,메시지발송 플랫폼 개발자,성남 분당구,,"개발 가능하면서 python 개발 경험 소유자(또는 Python 개발 가능... NET 또는 python 개발 경력 5년이상 - 자동화를 위한 스크립트(powershell, bash, python 등) 경험 - Windows..."
https://kr.indeed.com/viewjob?jk=55a19c92c845685e,Developer / Designer recruit,서울 논현동,,"language (i.e Python, Ruby, Java, .Net... High proficiency in Python... knowledge... least one Python web framework..."
https://kr.indeed.com/viewjob?jk=069278d922cccae3,로봇 플랫폼 개발자,서울 서초구,,Architecture 연구 개발 2. 경력 및 경험 - ROS1/2 기반 로봇 SW 개발 유경험자 - C/C++/ Python 중급 이상 - 임베디드 시스템 기반 SW 개발 유경험자 3. 우대사항 - 로봇 실무 경험자 우대...
https://kr.indeed.com/viewjob?jk=a2b38b230474e622,카카오 전사 QA 모집,성남 판교역,,"협업도구 (JIRA, Github 등)에 대한 경험이 있으신 분 테스트자동화 설계경험자 혹은 스크립트 언어( python, java, javascript 등) 가능자 긍정적인 마인드와 유연한 커뮤니케이션 능력 보유 능동적이고..."
https://kr.indeed.com/viewjob?jk=dbe3257e487e5814,[AI/Lab] AI 백엔드 엔지니어 (전문연구요원 가능),서울,,"플랫폼 및 시스템 구축 이런 분을 찾습니다 주도적으로 문제를 찾고, 해결할 수 있는 능력을 보유하신 분 Python 사용 경험이 있으신 분 다음 항목 중 두 가지 이상에 해당되는 분 AWS 혹은 GCP와 같은 클라우드 플랫폼..."
https://kr.indeed.com/viewjob?jk=0c03a792f8a2a803,(한화생명) 투자사업팀 경력채용,서울,,"계량모델 혹은 성과평가) : 금융시장 분석에 필요한 Tool 활용 가능자 우대(VBA, MATLAB, Python, R 등) - 자격증 : 금융관련 자격 보유자 우대 0명 본사(63빌딩) 한화인의 공고 내 '1:1 문의하기..."
https://kr.indeed.com/viewjob?jk=ea9918b20aa10f90,Applications Engineer (CATS/SmartMRC),대한민국,,"manufacturing technology Scripting skills for Linux, TCL, Python, Perl Excellent communication and organizational skills..."
https://kr.indeed.com/viewjob?jk=4cd34228af5013fd,DGIST 2019년 제1차 계약직원 공개채용 공고,대구 현풍면,,"우수자(SPSS, R 등 통계패키지) 외국어(영어) 구사 능력 우수자 Programming(MATLAB, Python, C/C++ 등) 가능자 · 근무기간 : 2019.3.11.~2020.3.10. ※ 단, 재계약 평가에..."
https://kr.indeed.com/viewjob?jk=f2be917c394cbe91,(주)코인플러그 서버 개발자,성남 분당구,,"능숙한 자ㆍ블록체인 기술에 관심이 많은 자[우대사항] ㆍgoLang, python, Java, kotlin, node.js 중 한가지 언어 이상 개발... 템분석·설계>AWS|인터넷·IT·통신·모바일·게임>웹프로그래머> Python"
https://kr.indeed.com/viewjob?jk=8e427bfa23c2365d,Machine Learning Engineer (LINE AI Services Lab),대한민국,,"있으신 분 Hadoop MR, Hive, Spark 등 대용량 처리 프레임워크 개발/사용 경험이 있으신 분 Python, Scala, SQL 등의 프로그래밍 언어를 사용할 수 있으신 분 해외 출장 및 근무에 결격 사유 없으신..."
https://kr.indeed.com/viewjob?jk=7420bd6ad89ff63a,미국 법인 보안 담당자,성남 판교역,,진행 가능하신 분 - 해외 근무에 결격 사유가 없는 분 - 악성코드 동적/정적 분석 능력 보유 - Python 등 스크립트 개발을 통한 업무 효율화 경험 - Elastic Stack에 대한 이해와 운영 경험 - 클라...
https://kr.indeed.com/viewjob?jk=fc09bd46b913c048,시스템 엔지니어링,성남 판교역,,"운영 경험 보유 - 쉘 스크립트 또는 프로그래밍 개발 스킬 보유 * Bash, PowerShell, Python, JAVA, etc * 운영 자동화/효율화 경험 보유 - 대용량 트래픽 처리를 위한 인프라 설계와 구축..."
https://kr.indeed.com/viewjob?jk=25725b3c0e607311,Junior Quant Trader,서울,,background is a plus Programming capability is mandatory (i.e. Python) Understanding of machine learning algorithm is a plus...
https://kr.indeed.com/viewjob?jk=4698c0e2364b5576,[넥슨·엔씨소프트등] 자바·파이썬 응용SW 개발자 양성교육 · 동종업계 신입 초봉5천1,서울 구로구,,통신·모바일·게임>응용프로그래머> Python|인터넷·IT·통신·모바일·게임... 웹프로그래머> Python|인터넷·IT·통신·모바일·게임>웹프로그래머>웹개발|인터넷·IT·통신·모바일·게임>빅데이터·AI(인공지능)> Python|인터넷...
https://kr.indeed.com/viewjob?jk=e8a4630bec0783e8,2021 Market Data Analyst - Seoul,서울,,"work experience using one more programming language... Python, SQL and R Fluency in Korean and English (both spoken..."
https://kr.indeed.com/viewjob?jk=6c3b5d4320d2c476,[젠틀몬스터] GENTLEMONSTER LAB 로봇 모션제어,서울 마포구,,"[지원자격] ㆍ경력 : 신입/무관 (해당 경험자 우대) [우대사항] ㆍC, C++, Python ㆍ게임 캐릭터 모션 경험 ㆍDC/BLDC/BLAC 모터제어 경험 ㆍROS 개발 경험 ㆍ로봇 개발 경험 ㆍAI(강화학습, GAN..."
https://kr.indeed.com/viewjob?jk=a4b72e38fb50bde0,콘텐츠서비스개발- 데이터엔지니어,성남 분당구,,"ecosystem 에 대한 이해 - Python, Scala 등의 프로그... 경험이나 운영 경험 - 소프트웨어 빌드 및 배포 자동화 경험 - Python 또는 NodeJS를 활용한 시스템 개발 경험 - 프론트엔드 및 웹..."
https://kr.indeed.com/viewjob?jk=6d6a50ade4777d90,로봇용 카메라 및 컴퓨터비전 SW개발자,서울 서초구,,"Robotics * Mendatory - Strong C/C++ Skills, Good skills on Python or simmilar script laguages - Strong understanding..."
https://kr.indeed.com/viewjob?jk=a1d687cd59776360,머신러닝 개발,성남 분당구,,모델 개발 - 머신러닝을 위한 솔루션 프로토타이핑 - 머신러닝 파이프라인 설계 및 구축 지원자격 - Python에 숙련된 프로그래밍 능력과 머신러닝 라이브러리 활용 경험 - 머신러닝과 강화학습에 관련된 지식 습득 혹은...
https://kr.indeed.com/viewjob?jk=f1a5b0fae1dc10a2,[한국기가포톤] Web Application Engineer 경력직원,경기도 화성,,"AI applications (e.g. experience in Python, TensorFlow, NumPy, jupyter notebook... including PHP, Python, Go, Java, C#..."
https://kr.indeed.com/viewjob?jk=68a69dd27ac61230,(데이터개발) 데이터 엔지니어,성남 분당구,,"끊임없이 흐르는 데이터를 모니터링하고 오류를 감지하는 시스템을 구축 지원자격 - Linux 환경에서 Python, Scala, Java, Go 중 한 가지 이상의 언어로 개발이 가능하신 분 - 자료구조, 알고리즘, 데이터..."
https://kr.indeed.com/viewjob?jk=43f8edb38c7888c7,[위메프오] 서버개발자(정규직),대한민국,,"데이터베이스 분산설계 및 미들웨어 개발 [자격사항] - 서버 프로그래밍 언어(PHP, Go, C/C++, Python, Java) 중 1개 이상 사용이 가능한 분 - 자료구조, 알고리즘, 분산처리 등 SW관련 기본지식 보유..."
https://kr.indeed.com/viewjob?jk=48f66fa2a4f847a5,(주)엘솔루 웹 프로그래머,서울,,그래머>웹개발|인터넷·IT·통신·모바일·게임>웹프로그래머>JAVA|인터넷·IT·통신·모바일·게임>웹프로그래머> Python|경영·인사·총무·사무>경영·기획·전략>경영기획|경영·인사·총무·사무>경영·기획·전략>사업기획|경영·인사...
https://kr.indeed.com/viewjob?jk=e0e37aaebc73dde3,지표구축,경기도 성남,,"대시보드 플랫폼의 활용이 가능하신분 - 새로운 서비스 출시후 모니터링이나 트랜드 확인이 가능하도록 설계나 지원이 가능하신분 - SQL,Excel,R, Python 등을 이용하여 데이터 추출 또는 분석이 가능하신 분"
https://kr.indeed.com/viewjob?jk=752a4b5d63eac97c,Back-end Engineer (Python),서울 강남구,,"찾아요 5년 이상의 웹/앱 서비스의 백엔드 시스템 개발 경험이 있으시거나 이에 준한 역량을 갖추신 분 Python(Django, Flask) 개발 경험이 있으신 분 AWS 환경에서의 개발이 익숙하신 분 git 기반 코드..."
https://kr.indeed.com/viewjob?jk=33caa1d9a2c68113,클라우드 데이터플랫폼 운영 엔지니어,성남 판교역,,"력자 -대외 고객 기술 지원 경험자 -클라우드 플랫폼 운영 경험자 -2년 이상의 개발 경험자(Java, Python 등) -Hadoop 에코시스템을 통한 데이터 수집, 처리 및 지표 분석 경험 본 채용은 상시 채용으..."
https://kr.indeed.com/viewjob?jk=d585814d097935eb,카카오톡 보이스톡/페이스톡/라이브톡 개발자 모집,성남 판교역,,"우대 사항 ✓ Spring/Java 혹은 Spring/Kotlin 기반 서버 개발 경험 ✓ MySQL, Python, JavaScript, Node.js 경험 ✓ 모바일/웹 환경을 위한 API 시스템 개발 경험 ✓ k8s..."
https://kr.indeed.com/viewjob?jk=72859ab8ad9a7cd0,글로벌 ICT전문가 양성과정 6기 참가자,대전 중구,,통신·모바일·게임>빅데이터·AI(인공지능)>데이터분석|인터넷·IT·통신·모바일·게임>빅데이터·AI(인공지능)> Python|인터넷·IT·통신·모바일·게임>빅데이터·AI(인공지능)>머신러닝|인터넷·IT·통신·모바일·게임>빅데이터...
https://kr.indeed.com/viewjob?jk=6d0095647ec5d2a4,광고데이터플랫폼 개발자 모집,성남 판교역,,"무와 데이터 파이프라인 시스템 설계/구축/관리 업무를 수행하게 됩니다. 지원자격 개발 경력 3년 이상 Python, Java, Kotlin, Scala 중 하나 이상의 언어에 능통 SQL 또는 HiveQL에 능통 대용량..."
https://kr.indeed.com/viewjob?jk=2061a9ebc542f2d5,"데이터 가공자 ,",서울 마포구,,"격요건]경력사항: 신입, 경력()학력사항: 대학(2,3년)졸업직무기술: Python, openCV 1 명 공통 자격요건ㆍ학력 : 대졸 이상 (2,3년... 게임>빅데이터·AI(인공지능)> Python|인터넷·IT·통신·모바일·게임..."
https://kr.indeed.com/viewjob?jk=df21e3bb5d773616,Python Programmer,서울 서초구,,개발 – JAVA 프로그래밍(라이브러리 활용) – Spring 프레임 워크 개발 – Python API 프로그래밍 우대사항 – Python 개발 경험 – Open Source 라이브러리 개발경험 – Web 표준에 대한 경험...
https://kr.indeed.com/viewjob?jk=ccd4f5407a32ba6a,Data Scientist,서울,,"analysis a plus, Programming... scripting exp.: eg. Python, C#, VBA, Java, Perl, etc. Experience in applied analytics..."
https://kr.indeed.com/viewjob?jk=7df915e1f0f86b2d,Software Architecture 설계 엔지니어,성남 분당구,"연봉 40,000,000원 - 100,000,000원",경험 - Windows/Linux 상에서 C++/ Python 언어 사용 개발 경험 - C++ / Python 언어 사용 개발 경험 - 객체지향 설계에... 게임>빅데이터·AI(인공지능)> Python|인터넷·IT·통신·모바일·게임...
https://kr.indeed.com/viewjob?jk=4d02228b32a46b17,[해외취업] Wall Streets 에 위치한 Financial Service 기업 Data Analyst...,서울 역삼동,,"computing / Database skills: Enterprise & Open-source software: Python, Java, R, C#, SQL, XPath, XQuery HTML5, CSS3, PHP..."
https://kr.indeed.com/viewjob?jk=06bd7cf4b32f5ac8,[HR Div.] 인사제도 기획 및 운영,서울,,"경험 게임 업계 및 PUBG에 대한 관심과 이해 Fluent level English Coding( Python, Java 등)이나 Data(SQL 등)관련 지식 보유 고용 형태 정규직 근무지 서울 본사 (역삼) 제출..."
https://kr.indeed.com/viewjob?jk=6b210054dfaf53d3,[AI R&D] User Profiling 및 서비스 사용성 분석 기술 분야 수시 모집,성남 판교역,,"하는 능력 - Python 언어에 능숙하신 분 2. 해당직무 입사자 필요 조건 - Machine Learning, 수학, 통계, Pattern Recognition, Data/Text Mining - Python 우대사항..."
