Link,Title,Location,Salary,Summary
https://kr.indeed.com/viewjob?jk=c04309036d0a44a1,바람의나라 게임프로그래머,성남 분당구,,서비스 경험이 있으신 분 - Linux 환경에서 개발 및 서비스 경험이 있으신 분 - Bash 쉘스크립트/ Python 스크립트 개발 경험이 있으신 분 - Yacc/Lex 개발 경험이 있으신 분 - Apache/PHP...
https://kr.indeed.com/viewjob?jk=59db18a2366b2c92,AI 분야 박사,서울,,"이상 (AI 관련 논문 발표) ② AI/딥러닝 알고리즘 연구개발 프로젝트 경험 ③ Ubuntu Linux, Python, Tensorflow, PyTorch 사용 중상급 이상 우대사항(해당 내용 중 1개 이상) ① AI/머신..."
https://kr.indeed.com/viewjob?jk=269f9a96319ef19a,머신러닝 엔지니어 모집,성남 판교역,,"델의 성능 검증 및 지속 개선 대규모 로그 데이터 통계 분석을 통한 피쳐 추출 지원자격 #필수사항 Python, Java, C++ 등 언어 중 하나 이상 활용 가능하신 분 TensorFlow/Keras, PyTorch..."
https://kr.indeed.com/viewjob?jk=b1376913a965e740,Deep Learning SW Engineer - Embedded-AI-Framework,서울,,related field. - Proficiency in C/C++ programming. - Python programming. - Basic knowledge of machine learning and deep...
https://kr.indeed.com/viewjob?jk=7fdcd7a7457b1e93,데이터 분석,경기도 성남,,"의 서비스 이용/소비형태/이상현상과 트렌드 변화가 궁금하신 분 - B2C서비스 데이터 분석 직군에서 데이터 핸들링 경험이 있으신 분 - SQL,Excel,R, Python 등을 이용하여 데이터 추출 또는 분석이 가능하신 분"
https://kr.indeed.com/viewjob?jk=166aa0c72e94a266,Business Data Analyst,서울 강남구,,"즈니스에 적용하고 개선한 경험 (Google Optimize, Optimizely, 등) 우대사항 • Python 또는 R 을 사용하여 데이터 분석에 활용 가능 • 경영학, 통계학, 경제학, data analysis 등..."
https://kr.indeed.com/viewjob?jk=e658236007117d98,Junior Business Analyst (Non-tech),서울,,"의와 체계적 사고체계를 갖추신 분 [우대 조건] 이커머스, 리테일, 물류 관련 도메인 경험을 보유하신 분 Python, R 등 기타 프로그램 언어 사용 경험을 보유하신 분 한국어 및 영어 모두 능숙한 커뮤니케이션이 가능하..."
https://kr.indeed.com/viewjob?jk=447e5726f229a2b7,"Cloud Technical Solutions Engineer, Networking",서울,,"reading or debugging code (e.g., Java, C, C++, .NET, Python, Shell, Perl, JavaScript). Experience advocating for customer..."
https://kr.indeed.com/viewjob?jk=db50e8f6906d9e66,대기업 영상처리 관련 IP 개발자 (판교),서울,"연봉 60,000,000원 - 70,000,000원","Verification- Mentor Catapult HLS Tool 경험자- Python 가능[근무부서 및 직급/직책]직급/직책: 대리, 과장... 게임>빅데이터·AI(인공지능)> Python|인터넷·IT·통신·모바일·게임..."
https://kr.indeed.com/viewjob?jk=e4e7e2e0d73f981f,Data Scientist,경기도 평택,,"Tools, and Techniques Demonstrated proficiency with R or Python, and SQL to manipulate data and draw insights from large..."
https://kr.indeed.com/viewjob?jk=e64d2f1e2de938b4,Solutions Architect,서울,,"languages... Ruby, Python and Node... 현대 개발 언어에 대한 실무적 지식: 루비 (Ruby), 파이썬 ( Python), Node.js 등 · 개발자 및 IT 운영자 대상의 신기술 전파에..."
https://kr.indeed.com/viewjob?jk=4de10ddc3715df93,"Software Engineer, Korea",서울,,"개발하며 운영합니다. 로봇에서 수집되는 데이터 처리하며 프로세스 자동화 환경을 구축합니다. 자격 요건 Python 개발 경력 3년 이상 혹은 그에 준하는 실력을 갖추신 분 기본적인 개발능력 (알고리즘, 자료구조, 운영체제..."
https://kr.indeed.com/viewjob?jk=d0784bcefe102ead,[Youpick] Backend Software Engineer (경력 2년 이상),서울 서초구,,"재고 관리 등 데이터를 기반으로 다양한 개발을 합니다. 팀에 합류하면 기존 유픽의 Backend 유지보수와 Python Django를 사용하여 API를 개발합니다. 디자인, 마케팅 팀과 주도적으로 협업하며 전반적인 개발 프로..."
https://kr.indeed.com/viewjob?jk=914c525415ad84aa,Backend Developer(Python or Java),서울,,"채용제목 Backend Developer( Python or Java) 회사소개 온라인 서비스 업무내용/자격요건 자격요건 - Python, Java, Ruby, Node.js 등을 사용한 5년 이상의 개발 경력 -Web..."
https://kr.indeed.com/viewjob?jk=a3b436f0e9cb53cb,Expat: Experimental Physicist / Engineer for Electron Optics...,경기도 화성,,Experience in using office programs and Unix (Linux) Python and Jira experience is preferred. Deliberate and organized work...
https://kr.indeed.com/viewjob?jk=dcdd6c20bd460c01,System Engineer 모집,성남 판교역,,"인프라 운영 경험 (프로비저닝, 설정 관리, 모니터링 등) - 운영에 필요한 도구 개발 (Shell / Python 중 하나 이상의 개발 경험 및 REST API 활용) 역량 우대사항 - 글로벌 서비스 Architecture..."
https://kr.indeed.com/viewjob?jk=eafb1e21a049e873,"챗봇 개발자 ,",서울 마포구,"연봉 30,000,000원 - 35,000,000원","경력사항: 신입, 경력(연차무관)학력사항: 대학교(4년)졸업직무기술: Python, Linux, 자연어처리(NLP), 인공지능 챗봇, 인공지능 (AI... 게임>빅데이터·AI(인공지능)> Python|인터넷·IT·통신·모바일·게임..."
https://kr.indeed.com/viewjob?jk=7a10f3521337083b,"Perception Engineer, Deep Learning - Autonomous Vehicles",서울,,"PyTorch, etc). Strong programming skills in C++... python. Outstanding communication and collaboration skills as we..."
https://kr.indeed.com/viewjob?jk=55a19c92c845685e,Developer / Designer recruit,서울 논현동,,"language (i.e Python, Ruby, Java, .Net... High proficiency in Python... knowledge... least one Python web framework..."
https://kr.indeed.com/viewjob?jk=6c1d50662fa2d7f7,서울 강남구 인썸니아 시니어 개발자 및 퍼블리셔,서울 서초구,,"개발자] 1) 경력: 3~5년차 2) skills: Rails, Python, Django, Node, react 중 한가지 이상 3) 연봉... Django, angular JS, Python 등을 능숙하게 사용하시는..."
https://kr.indeed.com/viewjob?jk=cc8bc7a6aebf16b3,Software Developer - OSS and Network Management,서울,,"Programming Language and skillset: Java(preferred), C++, Python, CI Environment, Shell Script Native Korean and business..."
https://kr.indeed.com/viewjob?jk=1e708a23b9f87c19,JAVA 개발자 경력직/신입,서울 성동구,,"경력직 정규직 채용 모집부문 및 자격요건 담당업무 자격요건 인원 [담당업무]Back-end 개발자(java, python 등)- Restful API 서비스 설계/연동 개발(Spring)- web 서비스 백엔드 개발front..."
https://kr.indeed.com/viewjob?jk=7fccab444e235947,Application Engineer - HAV,경기도 성남,,"C/C++ for IP verification Knowledge of scripting using Perl, Python, Makefile with UNIX... LINUX platforms Knowledge..."
https://kr.indeed.com/viewjob?jk=ee7e4f2e5d69f84c,DRE - Build Engineer,서울,,OO programming language · Experience with Python or related scripting language... Experience with Python or related...
https://kr.indeed.com/viewjob?jk=a1a89406f38aabeb,Social Media Data Analyst,대한민국,,경력이 있으신 분 주체적으로 도메인 업무를 분석하여 정리하는 데 익숙하신 분 데이터 분석 및 추출을 위한 Python 언어를 사용할 수 있으신 분 긍정적으로 다른 분야의 팀과 작업 및 협업할 수 있으신 분 관계형 DB의 사용...
https://kr.indeed.com/viewjob?jk=a2b38b230474e622,카카오 전사 QA 모집,성남 판교역,,"협업도구 (JIRA, Github 등)에 대한 경험이 있으신 분 테스트자동화 설계경험자 혹은 스크립트 언어( python, java, javascript 등) 가능자 긍정적인 마인드와 유연한 커뮤니케이션 능력 보유 능동적이고..."
https://kr.indeed.com/viewjob?jk=5964e895e5eaa8e5,백엔드 개발자,성남 분당구,,"주로 ASP.Net Core 로 개발 되어 있으며, akka.net. python, golang 으로 되어 있는 서비스들도 있기 때문에, 원하시는... asp.net core, C# 나 python 개발에 능숙 하신 분..."
https://kr.indeed.com/viewjob?jk=3b7dbdf85a326a6d,국내 대기업 - AI 및 딥러닝 관련 경력자,서울,,"관련 전문 지식 있는 분 - Python 또는 Scala, JAVA 활용... 레임워크 활용 역량 좋은 분- 자연어처리 관련 전문 지식 있는 분- Python 또는 Scala, JAVA 활용 역량- 미디어/커머스/전자/IT 업계..."
https://kr.indeed.com/viewjob?jk=2ed83a2b5e671038,광학솔루션사업부 R&D 신입 석/박사,경기도 안산,,"light Illumination microscopy - 프로그래밍 언어 사용 가능자 (Matlab, Python) [학력] - 박사 이상, 응용물리학 전공자 [모집 직무] - 카메라모듈/3D센싱모듈 양산개발 [필요직무상세..."
https://kr.indeed.com/viewjob?jk=06a6e700196764b9,[AI R&D] Language AI(NLP) Research 분야 수시 모집,성남 판교역,,"분 - 통계/Machine Learning에 대한 이해와 활용 능력 및 text 처리 기술에 대한 경험 - Python, Java 등을 이용하여 NLP 기술을 구현 가능한 분 - 최신 기술(논문, 기술문서 등)을 습득하는..."
https://kr.indeed.com/viewjob?jk=39e827a8a7606cc6,Analog Verification Engineer,대한민국,,"design tool set. Programming / scripting know-how, e.g., Python, skill, makefile or other programming script Why Join Us..."
https://kr.indeed.com/viewjob?jk=29faa893f345e036,GEDP,경기도 성남,,using C programming language Scripting languages like Lua/ Python/JavaScript may also be used if needed Support connected...
https://kr.indeed.com/viewjob?jk=aa13332a8009c705,Application Engineer Korea,경기도 화성,,"You are committing to support the team in challenging situations. Python, Office solutions and Linux experience is beneficial..."
https://kr.indeed.com/viewjob?jk=70fadfe5077b6728,"Software Engineer, Robotics",서울,,"구하고 필요한 기능을 개발합니다. 차세대 로봇 플랫폼 개발에 필요한 선행 연구를 수행합니다. 자격 요건 Python 및 C++ 개발 경력 3년 이상 혹은 그에 준하는 실력을 갖추신 분 알고리즘, 자료구조, 운영체제에 대한..."
https://kr.indeed.com/viewjob?jk=2b7c67c7f1fe78ff,PI&CS Engineer (Process Information & Control Solutions),전라남도,,"manufacturing applications Experience in language like C#, Python, Java, Java Script(one or more) Be fond of learning..."
https://kr.indeed.com/viewjob?jk=79304a56b5a6379b,Business Analyst,대한민국,,"engineering related research. • Broad working knowledge of Python, Excel (inc. automation skills), Relational DBs, SQL..."
https://kr.indeed.com/viewjob?jk=043516001b6ef966,교육 웹 서비스 기획/ 콘텐츠 서비스 기획,서울 성동구,"연봉 24,000,000원 - 26,000,000원","Science, Data Science, AI, Algorithm, Python 등... 데이터 분석, 인공지능, 프로그래밍 언어) 교육에 관심... AI, Algorithm, Python 등)• IT(데이터 분석, 인공지능..."
https://kr.indeed.com/viewjob?jk=d330e919051497ab,Data Scientist,경기도 화성,,long periods of time (up to 1 month each time). Programming – python proficient. Machine learning and data science experience...
https://kr.indeed.com/viewjob?jk=6a5f1bff2052e967,(쿠키런: 오븐브레이크) 데이터 분석가 (신입/경력),서울 신사동,,"뿐만 아니라 PC, 콘솔 등 다양한 플랫폼에서) - Python Skill: Python을 활용한 데이터 처리에 능숙하신 분 -SQL Skill... 작성 ※ 필수 항목: 1) Python 또는 SQL 프로그래밍 역량 2..."
https://kr.indeed.com/viewjob?jk=1fddea3f6e90d96d,데이터 엔지니어(신입/경력),서울 강남구,,"인프라 개발 & 관리 • 데이터 분석 업무 자격요건 • Java, Kotlin, Scala, Python 사용 경험 • SQL 사용 경험 우대사항 • Spark 사용 경험 • Hadoop 사용 경험 • 데이터..."
https://kr.indeed.com/viewjob?jk=a230c1e855057568,[웹젠] 사내IT인프라(신입/경력),성남 분당구,,"Terraform 등 운영 경험이 있는 분 - Powershell, Python, Bash,Batch 작성이 가능한 분 - L2,L3 네트워크 기본... 있는 분 - Powershell, Python, Bash,Batch 작성이..."
https://kr.indeed.com/viewjob?jk=662beff5f293820b,AR/VR SDK 개발자 모집,성남 판교역,,"iOS 및 PC/Web 플랫폼향 API 개발 (C++, Java/Kotlin, ObjC/Swift, Python, Javascript) 멀티플랫폼 패키징 및 배포시스템 개발, 유지보수 모바일 최적화 및 플랫폼 이슈 대응..."
https://kr.indeed.com/viewjob?jk=e2f46a6ea1584be6,"Lead Software Engineer, Machine Learning, Google Search",서울,,"machine learning. Experience coding in C++, C, or Python. Ability to speak and write in English fluently. Preferred..."
https://kr.indeed.com/viewjob?jk=fabe4457e229c111,(주)엘솔루 음성인식팀 개발직,서울,,인터넷·IT·통신·모바일·게임>응용프로그래머>머신러닝(ML)|인터넷·IT·통신·모바일·게임>응용프로그래머> Python|무역·영업·판매·매장관리>기술영업>SI(Solution·System)|무역·영업·판매·매장관리>기술영업...
https://kr.indeed.com/viewjob?jk=3d8c890cd0f75b23,Field Code Scanning Architect,서울,,"languages: C, C++, C#, JAVA, JavaScript/TypeScript, Python, Haskell, Ruby and Go. Experience with relational databases..."
https://kr.indeed.com/viewjob?jk=15e3d11c1ab81943,"Software Engineer (AI & Autonomy, MLOps)",서울,,"more than one software languages (e.g. C, C++, C#, Java, Python, Javascript, and so on) Strong passion for developing high..."
https://kr.indeed.com/viewjob?jk=9e1861e691426a98,Field AI Engineer,서울,,"hardware acceleration technologies Experience with Python and C++... depth knowledge of computer architectures, high..."
https://kr.indeed.com/viewjob?jk=61c3e3d37ef5d337,빅데이터(IT) 엔지니어 경력직 채용공고,대한민국,,"Common Data Model 관련 프로젝트 경험자 우대 라. NoSQL, Oracle, Sybase, R, Python 가능자 우대 마. 서버관리/정보보안, 텍스트마이닝 경험자 우대 - 담당업무 가. 데이터 레이크/데이..."
https://kr.indeed.com/viewjob?jk=22123968c1ca16d9,대기업 AI NPU 개발자 (판교),서울,"연봉 70,000,000원 - 80,000,000원","Competencies- C/C++, Python Language... RTL Simulation and Verification- C/ Python 기반 모델 RTL 변환 가능 기술[근무부서 및 직급/직책]직급/직책: 과장..."
https://kr.indeed.com/viewjob?jk=5b2574aec8e1d083,딥러닝 개발자 정규직,서울 강남구,,"라우드 기반 인프라 활용 - 데이터 수집, 전처리, 통합 자격 조건 - 데이터, 딥러닝 분야에 대한 이해 - Python 코딩능력 - 리눅스 사용 경험 우대 사항 - 영어 리딩 능력 - 의약분야 프로젝트 경험 - 플랫폼개발에..."
https://kr.indeed.com/viewjob?jk=43f8edb38c7888c7,[위메프오] 서버개발자(정규직),대한민국,,"데이터베이스 분산설계 및 미들웨어 개발 [자격사항] - 서버 프로그래밍 언어(PHP, Go, C/C++, Python, Java) 중 1개 이상 사용이 가능한 분 - 자료구조, 알고리즘, 분산처리 등 SW관련 기본지식 보유..."
https://kr.indeed.com/viewjob?jk=3c2bf0ec25a85c9f,"Senior Analyst - Data Science, Marketing & Sales",서울,,mathematics) 4+ years of experience working with SQL and Python or R programming Ability to manage and query large databases...
https://kr.indeed.com/viewjob?jk=65f5be42f37df000,백엔드 엔지니어(신입/경력),서울 강남구,,"유지보수 • 번역물 Search Engine 개발 및 유지 보수 자격요건 • Java, Kotlin, Python 사용 경험 • Spring Boot외 Web Framework 사용 경험 우대사항 • ORM 사용..."
https://kr.indeed.com/viewjob?jk=c269b5db3e5a68d4,Data Mining Specialist,서울,,"Preferably understanding of analytics and business intelligence technologies... R, Python, Power BI or MS AI solutions"
https://kr.indeed.com/viewjob?jk=695713f706e2220e,[정규직] Data Scientist,서울,,"규모 데이터 처리 경험 우대 역량/스킬 * 통계분석, ML/DL 전문 지식 및 업무 활용 역량 * 분석 Tool( Python, R, TensorFlow 등) 활용 역량 * ML/DL (Machine Learning, Deep..."
https://kr.indeed.com/viewjob?jk=c6cbe4d8dd9afcb1,사내 및 서비스 보안 담당자 (경력),대한민국,,"있는 분 - IDS / IPS 패턴 분석 및 Rule 개발 경력이 있는 분 - 각종 스크립트 언어(Perl, Python, shell script 등)의 활용 능력을 갖춘 분 모집기간 채용시 마감 고용형태 정규직"
https://kr.indeed.com/viewjob?jk=e97e5ff34697d5a9,[KRAFTON] 음성 (TTS/STT) 딥러닝 엔지니어,서울,,험을 보유하신 분 독창적인 기술 제시 및 문제 해결을 위한 프로그래밍 능력을 보유하신 분 (C/C++/ Python/shell 등) 오픈소스 기반 딥 러닝 프레임워크 활용 능력을 보유하신 분 (PyTorch/TensorFlow...
https://kr.indeed.com/viewjob?jk=0c32e6464cad3b0a,[카카오 클라우드]DBaaS(DataBase As A Service) 개발자 모집,성남 판교역,,"및 유지 보수 지원자격 필수 자격 협업을 우선 가치로 유연한 커뮤니케이션이 가능하신 분 golang, python 등으로 API 기반 서비스를 구현해본 경험이 있으신 분 서비스 요구 사항을 기능으로 구현할 수 있는 분..."
https://kr.indeed.com/viewjob?jk=1344fe4ee44b4959,[웹젠] 서버(R2)(신입/경력),성남 분당구,,"사용자 - 유연한 사고와 원활한 의사소통 능력 보유자 ﻿ 우대사항 - Python, freebsd, MySql 경험자 - STL, Socket... 능력 보유자 ﻿ 우대사항 - Python, freebsd, MySql..."
https://kr.indeed.com/viewjob?jk=1cff0856686c501c,[GC녹십자지놈]AI팀 팀원,용인 기흥구,,모바일·게임>빅데이터·AI(인공지능)>인공지능(AI)|인터넷·IT·통신·모바일·게임>빅데이터·AI(인공지능)> Python|인터넷·IT·통신·모바일·게임>빅데이터·AI(인공지능)>데이터분석|전자·기계·기술·화학·연구개발>광학...
https://kr.indeed.com/viewjob?jk=35f72aeb142bceaa,[NIT Service] NAVER IDC 서버 운영/관리(춘천),강원도 춘천,,"application 운영 경험 - Shell script, python 활용 가능 - 해외 데이터센터 인프라 구축 또는 운영 경험 - 국가보훈대상자... 경험 - Shell script, python 활용 가능 - 해외 데이터센..."
https://kr.indeed.com/viewjob?jk=0c09254fab96033b,[PUBG Revenue Analytics Team] Data Analyst,서울,,"소통 자격 요건 관련 경력 2년 이상 통계/수학/프로그래밍을 비롯한 quantitative 영역 전공자 Python, SQL 혹은 실무에서의 프로그래밍 언어 활용 경험 커뮤니케이션 능력이 좋으신 분 PUBG 게임을 좋아하..."
https://kr.indeed.com/viewjob?jk=ebb960c140dd1e80,[뉴딜일자리 사업] 5G AI 활용 영상보안 교육생,대구 동구,,통신·모바일·게임>빅데이터·AI(인공지능)>데이터분석|인터넷·IT·통신·모바일·게임>빅데이터·AI(인공지능)> Python|인터넷·IT·통신·모바일·게임>빅데이터·AI(인공지능)>머신러닝|인터넷·IT·통신·모바일·게임>빅데이터...
https://kr.indeed.com/viewjob?jk=e74ea031c23c06f8,[교원그룹] AI혁신센터 경력직 수시 상시 지원(영입 시 종료),서울 중구,,통신·모바일·게임>빅데이터·AI(인공지능)>데이터분석|인터넷·IT·통신·모바일·게임>빅데이터·AI(인공지능)> Python|인터넷·IT·통신·모바일·게임>빅데이터·AI(인공지능)>머신러닝|인터넷·IT·통신·모바일·게임>응용프로...
https://kr.indeed.com/viewjob?jk=d6c05c588971df5a,백엔드 파운트 시스템 엔지니어 (현재 급여수준 이상 보장),서울 충정로역,,"경험 - Linux명령어 및shell스크립트 작성 능숙 우대사항 - Python, Java등을 이용한 프로그래밍 경험 네트워크및 서버에 대한 표준화... 립트 작성 능숙 우대사항 - Python, Java등을 이용한 프로그래..."
https://kr.indeed.com/viewjob?jk=d5c2721b4f838e42,에프앤가이드 - 각 부문 (전문연구요원 포함),대한민국,,"이공계열 석사학위 이상 취득(예정)자 - 우대사항 : ㆍ SQL, python, R 개발경험 소유자 디지털금융팀 - 담당업무 : ㆍ마이데이터 및... 문을 이해/구현 가능한 분 ㆍ Python 등의 언어를 이용한 서비스 개발..."
https://kr.indeed.com/viewjob?jk=a4015a0d112e9569,프론트엔드 정규직,서울 강남구,,"프론트 엔드 구현 - DB 구축 - 신규 기능 개발 및 반영, 지속적인 개선 및 유지 보수 자격 조건 - Python, Django - RDBMS 경험 - UI개발 경험 우대 사항 - 딥러닝에 관심있으신 분 - 단위 테스트..."
https://kr.indeed.com/viewjob?jk=36df1dfea186e63e,BIOS/Firmware Engineer,서울,,"years experience required on BIOS/Firmware - Knowledge of C, Python... other programming or scripting languages - Broad..."
https://kr.indeed.com/viewjob?jk=b231756686b3838e,(주)아이옵스 소프트웨어 개발자,대전 유성구,,"트스트랩, 웹개발, C++, C#, python, java 등 1개 이상의... 우대사항]- 자바스크립트, 부트스트랩, 웹개발, C++, C#, python, java 등 1개 이상의 개발환경 능숙자- Windows, Linux..."
https://kr.indeed.com/viewjob?jk=d2475b9f00f58b97,[AI R&D] ML 엔지니어 모집,성남 판교역,,pipeline 설계 및 구현 기술 연구 개발 지원자격 학력 : 학사 이상 경력기간 : 3년 ~ 필수조건 - Python 언어 및 SQL 쿼리 작업에 능숙하신 분 - ML 도구(scikit-learn/Spark MLlib...
https://kr.indeed.com/viewjob?jk=f95c15f488ce8463,"웹 프론트엔드 개발자(HTML, CSS, Java 등)",서울 서초구,,"javascript - Python 기본 문법 우대사항 - git 협력... 프론트엔드 개발자격조건: - HTML, CSS- javascript- Python 기본 문법우대사항- git 협력 가능- Django 프로젝트 구조..."
https://kr.indeed.com/viewjob?jk=1bc35c9f3d81a2c8,CDN / Cloud 서비스 매니저,서울 강남구,,"스템 경험 TCP / IP 프로토콜, DNS, HTTP 프로토콜에 대한 지식 보유 강력한 Linux 기술 Python / Shell 프로그래밍을 사용하여 작업을 자동화하고 도구를 개발하는 기능 HTML, Java Script..."
https://kr.indeed.com/viewjob?jk=5fc53d8ce25c05f7,IT 개발 총 책임자,서울 성동구,"연봉 90,000,000원 - 100,000,000원",스템접수양식: 인크루트 이력서 기타 유의사항 입사지원서 및 제출서류에 허위사실이 있을 경우 채용이 취소될 수 있습니다. 인터넷·IT·통신·모바일·게임>웹프로그래머>웹개발|인터넷·IT·통신·모바일·게임>웹프로그래머> Python
https://kr.indeed.com/viewjob?jk=45f9a39bdf645e57,기술혁신센터 경력사원,충청남도 천안,,"OHT 등) 천안 컴퓨터/시스템 전기/전자 기계/산공 *전문지식 - Java, C#, C++, Python - Oracle (PL/SQL) - Automod, VisualComponent - 통신프로그래밍..."
https://kr.indeed.com/viewjob?jk=90e64b198f0d1e74,"[전주] 랜선하우스 웹개발, Python",전주 완산구,,"소지자 (유)랜선하우스부동산투어 [신입/경력]랜선하우스에서 웹개발, Python 모집합니다. 모집부문 및 자격요건 담당업무 자격요건 인원 [담당업무... 웹프로그래머>웹개발|인터넷·IT·통신·모바일·게임>웹프로그래머> Python"
https://kr.indeed.com/viewjob?jk=15edcadd124ad99a,매칭 데이터분석,성남 분당구,,"최적화 된 모델을 적용하고 평가합니다. 지원자격 [이런 경험을 가진 파티원을 찾습니다.] - SQL, Python 등의 언어를 통해 데이터를 가공한 경험이 있는 분을 찾습니다. - 문제에 적합한 머신러닝 모델을 선택하고..."
https://kr.indeed.com/viewjob?jk=cb29579c3753c9b0,[주식회사 브레인벤쳐스]데이터 셋 구축 인력 정규/인턴직,성남 시흥동,,모집직종 데이터 전문가 관련직종 - 직무내용 데이터 셋 구축 인력 모집 [Cpp / Python] 웹 개발[JAVA / PHP] 인력 모집 [문화콘텐츠>문화콘텐츠제작>스마트문화앱콘텐츠제작] 스마트문화앱 개발환경 구축 개발...
https://kr.indeed.com/viewjob?jk=dc74730c92ce5050,Data Scientist,서울 영등포구,,"기반 예측, 모델링 프로젝트 경험자 데이터 분석/모델링을 위한 언어 및 프레임워크 사용에 익숙하신 분 ( Python, R, SQL, Pandas, TensorFlow, Pytorch, Spark 등) 회사 내부 구성원들과..."
https://kr.indeed.com/viewjob?jk=64e8a0d36e790764,ASIC 디지털 로직설계 연계형 인턴,서울 서초구,,"설계 경험 - FPGA 기반의 Hardware 검증경험 - UVM 활용 역량 보유 - 스크립트 언어( Python, Shell script, etc)를 활용한 automation 역량보유 함께하고 싶은 사람 - 새로운 것을..."
https://kr.indeed.com/viewjob?jk=feb01534780035d3,야구 AI 기술 연구자 모집,성남 판교역,,행한 프로젝트 포함 ) 2. 야구에 대한 관심 및 열정 3. 기술탐색 및 문제해결능력 보유 우대사항 1. Python 개발역량 보유 2. 다양한 DB로 부터의 데이터 핸들링 경험 3. AI기술 실제 서비스 적용 경험( 기획...
https://kr.indeed.com/viewjob?jk=1b62babbbf2d717a,경험최적화 - 데이터 사이언티스트/분석가,성남 분당구,,피처 탐색 등) - 게임 내 행동 패턴 로그 분석과 패턴 식별 및 이를 통한 서비스 개선 지원자격 - Python을 사용한 데이터 분석 및 모델 개발 경험 - 머신러닝 라이브러리 활용 경험 - 셀프 모티베이션과 원활한...
